{
  "$schema": "https://json-schema.org/draft/2020-12/schema",
  "$id": "urn:warehouse:events:receiving.receipt-posted:v1",
  "title": "ReceivingPostedV1",
  "type": "object",
  "required": ["eventId", "type", "schemaVersion", "aggregateType", "aggregateId", "aggregateVersion", "occurredAt", "correlationId", "payload"],
  "properties": {
    "eventId": { "type": "string", "format": "uuid" },
    "type": { "const": "receiving.receipt-posted" },
    "schemaVersion": { "const": 1 },
    "aggregateType": { "const": "receipt" },
    "aggregateId": { "type": "string", "format": "uuid" },
    "aggregateVersion": { "type": "integer", "minimum": 1, "maximum": 9007199254740991 },
    "occurredAt": { "type": "string", "format": "date-time", "pattern": "Z$" },
    "correlationId": { "type": "string", "format": "uuid" },
    "causationId": { "type": "string", "format": "uuid" },
    "traceparent": { "type": "string", "maxLength": 512 },
    "payload": {
      "type": "object",
      "required": ["receiptId", "warehouseId", "receivingLocationId", "lines"],
      "properties": {
        "receiptId": { "type": "string", "format": "uuid" },
        "warehouseId": { "type": "string", "format": "uuid" },
        "receivingLocationId": { "type": "string", "format": "uuid" },
        "lines": {
          "type": "array",
          "minItems": 1,
          "items": {
            "type": "object",
            "required": ["receiptLineId", "productId", "quantity"],
            "properties": {
              "receiptLineId": { "type": "string", "format": "uuid" },
              "productId": { "type": "string", "format": "uuid" },
              "quantity": { "type": "integer", "minimum": 1, "maximum": 2147483647 }
            }
          }
        }
      }
    }
  }
}
